"Id";"Name";"Year";"Release Date";"Director";"Creator";"Actors";"Cast";"Language";"Country";"Duration";"RatingValue";"RatingCount";"ReviewCount";"Genre";"Filming Locations";"Description"
"tt0455824";"Australia";"2008";"26 November 2008 (USA)";"Baz Luhrmann";"Stuart Beattie,Baz Luhrmann";"Nicole Kidman,Hugh Jackman,Shea Adams";"Shea Adams,Eddie Baroo,Ray Barrett,Tony Barry,Jamal Sydney Bednarz,Damian Bradford,Bryan Brown,Nathin Butler,Tara Carpenter,Rebecca Chatfield,Lillian Crombie,Max Cullen,Essie Davis,Arthur Dignam,Michelle Dyzla";"English,Aboriginal,Chinese,Japanese";"Australia,USA,UK";"165 min";"6.6";"97,838";"444 user,242 critic";"Adventure,Drama,Romance";"Bowen, Queensland, Australia";"Set in northern Australia before World War II, an English aristocrat who inherits a sprawling ranch reluctantly pacts with a stock-man in order to protect her new property from a takeover plot. As the pair drive 2,000 head of cattle over unforgiving landscape, they experience the bombing of Darwin, Australia, by Japanese forces firsthand."
"tt0240468";"Kung Pow: Enter the Fist";"2002";"25 January 2002 (USA)";"Steve Oedekerk";"Steve Oedekerk";"Steve Oedekerk,Fei Lung,Leo Lee";"Steve Oedekerk,Fei Lung,Leo Lee,Ling-Ling Hsieh,Lin Yan,Chia Yung Liu,Hui Lou Chen,Chi Ma,Jennifer Tung,Ming Lo,Peggy Lu,Tad Horino,Tori Tran,Simon Rhee,Joon Kim";"English";"USA,Hong Kong";"81 min";"6.2";"36,121";"516 user,62 critic";"Action,Comedy";"Fox Baja Studios, Rosarito, Baja California Norte, Mexico";"A rough-around-the-edges martial arts master seeks revenge for his parent's death."
"tt1214962";"Seeking Justice";"2011";"2 September 2011 (Italy)";"Roger Donaldson";"Todd Hickey,Robert Tannen";"Nicolas Cage,January Jones,Guy Pearce";"Nicolas Cage,January Jones,Guy Pearce,Harold Perrineau,Jennifer Carpenter,Irone Singleton,Wayne Pére,Xander Berkeley,Marcus Lyle Brown,Dikran Tulaine,Joe Chrest,Demetrius Bridges,Jason Davis,Brett Gentile,Renwick D. Scott II";"English";"USA";"105 min";"6.2";"36,976";"93 user,123 critic";"Action,Drama,Thriller";"Superdome - 1500 Poydras Street, New Orleans, Louisiana, USA";"After his wife is assaulted, a husband enlists the services of a vigilante group to help him settle the score. Then he discovers they want a 'favor' from him in return."
"tt0093737";"The Pick-up Artist";"1987";"18 September 1987 (USA)";"James Toback";"James Toback";"Molly Ringwald,Robert Downey Jr.,Dennis Hopper";"Molly Ringwald,Robert Downey Jr.,Dennis Hopper,Danny Aiello,Mildred Dunnock,Harvey Keitel,Brian Hamill,Tamara Bruno,Vanessa Williams,Angie Kempf,Polly Draper,Fred Koehler,Robert Towne,Victoria Jackson,Lorraine Bracco";"English";"USA";"81 min";"5.1";"4,580";"27 user,10 critic";"Comedy,Crime,Drama";"Atlantic City, New Jersey, USA";"A womanizer meets his match when he falls for a woman in debt to the mafia."
"tt1201167";"Funny People";"2009";"31 July 2009 (USA)";"Judd Apatow";"Judd Apatow";"Adam Sandler,Seth Rogen,Leslie Mann";"Adam Sandler,Seth Rogen,Leslie Mann,Eric Bana,Jonah Hill,Jason Schwartzman,Aubrey Plaza,Maude Apatow,Iris Apatow,RZA,Aziz Ansari,Torsten Voges,Allan Wasserman,Rod Man,Wayne Federman";"English";"USA";"146 min";"6.4";"97,433";"301 user,229 critic";"Comedy,Drama";"Griffith Observatory, 2800 E Observatory Rd, Los Angeles, California, USA";"When seasoned comedian George Simmons learns of his terminal, inoperable health condition, his desire to form a genuine friendship causes him to take a relatively green performer under his wing as his opening act."
"tt1090674";"Opposite Day";"2009";"October 2009 (USA)";"R. Michael Givens";"Steven Paul,Max Botkin";"Billy Unger,Ariel Winter,Pauly Shore";"Billy Unger,Ariel Winter,Pauly Shore,Colleen Crabtree,Dylan Cash,Dick Van Patten,Renée Taylor,French Stewart,Kristen Combs,Rico Rodriguez,Nadji Jeter,Casey Margolis,Braen Edwine,Will Shadley,Christian Pikes";"English";"USA";"88 min";"4.1";"609";"6 user,5 critic";"Comedy,Family";"Santa Clarita, California, USA";"The world goes backwards on Opposite Day. The kids become adults, and the adults become kids."
"tt1121096";"Seventh Son";"2014";"6 February 2015 (USA)";"Sergey Bodrov";"Charles Leavitt,Steven Knight";"Ben Barnes,Julianne Moore,Jeff Bridges";"Jeff Bridges,Ben Barnes,Julianne Moore,Alicia Vikander,Antje Traue,Olivia Williams,John DeSantis,Kit Harington,Djimon Hounsou,Gerard Plunkett,Jason Scott Lee,Kandyse McClure,Luc Roderique,Zahf Paroo,Timothy Webber";"English";"USA,UK,Canada,China";"102 min";"5.5";"43,770";"139 user,168 critic";"Action,Adventure,Fantasy";"Horsethief Canyon, Drumheller, Alberta, Canada";"When Mother Malkin, the queen of evil witches, escapes the pit she was imprisoned in by professional monster hunter Spook decades ago and kills his apprentice, he recruits young Tom, the seventh son of the seventh son, to help him."
"tt0427152";"Dinner for Schmucks";"2010";"30 July 2010 (USA)";"Jay Roach";"David Guion,Michael Handelman";"Steve Carell,Paul Rudd,Stephanie Szostak";"Steve Carell,Paul Rudd,Zach Galifianakis,Jemaine Clement,Stephanie Szostak,Lucy Punch,Bruce Greenwood,David Walliams,Ron Livingston,Larry Wilmore,Kristen Schaal,P.J. Byrne,Andrea Savage,Nick Kroll,Randall Park";"English";"USA";"114 min";"5.9";"75,714";"260 user,188 critic";"Comedy";"Westwood Village, Westwood, Los Angeles, California, USA";"When he finds out that his work superiors host a dinner celebrating the idiocy of their guests, a rising executive questions it when he's invited, just as he befriends a man who would be the perfect guest."
"tt1389127";"Texas Killing Fields";"2011";"14 October 2011 (UK)";"Ami Canaan Mann";"Don Ferrarone";"Sam Worthington,Chloë Grace Moretz,Jeffrey Dean Morgan";"Sam Worthington,Jeffrey Dean Morgan,Jessica Chastain,Chloë Grace Moretz,Jason Clarke,Annabeth Gish,Sheryl Lee,Stephen Graham,Corie Berkemeyer,Trenton Perez,Maureen Brennan,Tony Bentley,Becky Fly,James Landry Hébert,John Neisler";"English";"USA";"105 min";"5.7";"13,577";"69 user,113 critic";"Crime,Drama,History";"Amite, Louisiana, USA";"In the Texas bayous, a local homicide detective teams up with a cop from New York City to investigate a series of unsolved murders."
"tt0022775";"Frisco Jenny";"1932";"14 January 1933 (USA)";"William A. Wellman";"Wilson Mizner,Robert Lord";"Ruth Chatterton,Louis Calhern,Helen Jerome Eddy";"Ruth Chatterton,Louis Calhern,Helen Jerome Eddy,Donald Cook,James Murray,Hallam Cooley,Pat O'Malley,Harold Huber,Robert Emmett O'Connor,Willard Robertson";"English";"USA";"73 min";"6.8";"650";"17 user,7 critic";"Drama";"Market Street, San Francisco, California, USA";"Frisco Jenny was orphaned by the 1906 earthquake and fire and has become the madame of a prosperous bawdy house. She puts her son up for adoption and he rises to prominence as district ..."
"tt0082467";"Graduation Day";"1981";"1 May 1981 (USA)";"Herb Freed";"Anne Marisse,Herb Freed";"Christopher George,Patch Mackenzie,E. Danny Murphy";"Christopher George,Patch Mackenzie,E. Danny Murphy,E.J. Peaker,Michael Pataki,Richard Balin,Carmen Argenziano,Beverly Dixon,Virgil Frye,Hal Bokar,Denise Cheshire,Bill Hufsey,Linnea Quigley,Karen Abbott,Vanna White";"English";"USA";"96 min";"4.3";"1,676";"58 user,75 critic";"Horror,Mystery";"Pasadena, California, USA";"After a high school track runner suddenly dies from a heart attack after finishing a 30-second 200-meter race, a masked killer begins murdering her friends on the school track team one by one."
"tt1231580";"Alvin and the Chipmunks: The Squeakquel";"2009";"23 December 2009 (USA)";"Betty Thomas";"Jon Vitti,Jonathan Aibel";"Jason Lee,Zachary Levi,David Cross";"Zachary Levi,David Cross,Jason Lee,Justin Long,Matthew Gray Gubler,Jesse McCartney,Amy Poehler,Anna Faris,Christina Applegate,Wendie Malick,Anjelah Johnson-Reyes,Kathryn Joosten,Kevin G. Schmidt,Chris Warren,Bridgit Mendler";"English,French";"USA";"88 min";"4.5";"28,087";"95 user,105 critic";"Animation,Comedy,Family";"Paris, France";"The world famous singing pre-teen chipmunk trio return to contend with the pressures of school, celebrity, and a rival female music group known as The Chipettes."
"tt1399103";"Transformers: Dark of the Moon";"2011";"29 June 2011 (USA)";"Michael Bay";"Ehren Kruger";"Shia LaBeouf,Rosie Huntington-Whiteley,Tyrese Gibson";"Shia LaBeouf,Rosie Huntington-Whiteley,Josh Duhamel,John Turturro,Tyrese Gibson,Patrick Dempsey,Frances McDormand,John Malkovich,Kevin Dunn,Julie White,Alan Tudyk,Ken Jeong,Glenn Morshower,Lester Speight,Buzz Aldrin";"English";"USA";"154 min";"6.3";"304,716";"896 user,421 critic";"Action,Adventure,Sci-Fi";"Old Post Office, Chicago, Illinois, USA";"The Autobots learn of a Cybertronian spacecraft hidden on the moon, and race against the Decepticons to reach it and to learn its secrets."
"tt1270835";"Hatchet II";"2010";"November 2010 (Australia)";"Adam Green";"Adam Green";"Danielle Harris,Kane Hodder,Tony Todd";"Danielle Harris,Tony Todd,Kane Hodder,Parry Shen,Tom Holland,R.A. Mihailoff,AJ Bowen,Alexis Kendra,Ed Ackerman,David Foy,Colton Dunn,Rick McCallum,John Carl Buechler,Kathryn Fiore,Erika Hamilton";"English";"USA";"85 min";"5.4";"8,716";"65 user,129 critic";"Comedy,Horror,Thriller";"Hollywood, Los Angeles, California, USA";"Marybeth escapes the clutches of the bayou-butcher Victor Crowley and returns to the swamp with an army of hunters and gunmen, determined to end Crowley's reign of horror once and for all."
"tt3725034";"Pups United";"2015";"15 September 2015 (USA)";"Guy Distad";"Nolan Pielak,Willem Wennekers";"Rob Schneider,Kristin Carey,Challen Cates";"Rob Schneider,Kristin Carey,Challen Cates,Mark Falvo,Mickey Gooch Jr.,Kuma,Brigitte the Dog,Zachary Davis Brown,Annie Kitral,Matthew James Roberts,Ashley Bornancin,Dawn Maxwell,James Kisicki,Trevor Black,Mark Silverman";"English";"USA";"85 min";"5.9";"28";"1 critic";"Family";"Cleveland, Ohio, USA";"A ragtag gang of international talking-dog mascots must save the day and foil the plot of villains planning to sabotage the Youth World Cup soccer finals."
"tt0235048";"Wicked Spring";"2002";"15 February 2007 (USA)";"Kevin R. Hershberger";"Kevin R. Hershberger";"Brian Merrick,DJ Perry,Terry Jernigan";"Brian Merrick,DJ Perry,Terry Jernigan,Aaron Jackson,Curtis Hall,Mark Lacy,Lindsey Ingram,Rebecca Lawlor,John Pagano,Anthony Hornus,Jim Schruefer,Barry Privett,Leonard J. Krawezyk,Leonard J. Krawczyk II,Mac Butler";"English";"USA";"102 min";"5.5";"500";"60 user,1 critic";"Drama,War,Western";"Fort Pickett, Blackstone, Virginia, USA";"During the 1864 battle of the Wilderness, three Union soldiers and three Confederate Soldiers get seperated from their units as twilight engulfs the ravaged battlefield. The men wander ..."
"tt3727982";"Ava's Possessions";"2015";"13 March 2015 (USA)";"Jordan Galland";"Jordan Galland";"Carol Kane,William Sadler,Alysia Reiner";"Carol Kane,William Sadler,Alysia Reiner,Jemima Kirke,Lou Taylor Pucci,Dan Fogler,Wass Stevens,Whitney Able,John Ventimiglia,Deborah Rush,Zachary Booth,Louisa Krause,Joel de la Fuente,Geneva Carr,Stella Schnabel";"English";"USA";"89 min";"5.9";"106";"2 user,16 critic";"Mystery,Sci-Fi,Thriller";;"A young woman recovers from a demonic possession."
"tt0041594";"Little Women";"1949";"April 1949 (USA)";"Mervyn LeRoy";"Andrew Solt,Sarah Y. Mason";"June Allyson,Peter Lawford,Margaret O'Brien";"June Allyson,Peter Lawford,Margaret O'Brien,Elizabeth Taylor,Janet Leigh,Rossano Brazzi,Mary Astor,Lucile Watson,C. Aubrey Smith,Elizabeth Patterson,Leon Ames,Harry Davenport,Richard Wyler,Connie Gilchrist,Ellen Corby";"English";"USA";"122 min";"7.3";"4,486";"53 user,9 critic";"Drama,Family,Romance";"Metro-Goldwyn-Mayer Studios - 10202 W. Washington Blvd., Culver City, California, USA";"Louisa May Alcott's autobiographical account of her life with her three sisters in Concord Mass in the 1860s. With their father fighting in the civil war, the sisters: Jo, Meg, Amy and Beth..."
"tt0045479";"The Affairs of Dobie Gillis";"1953";"14 August 1953 (USA)";"Don Weis";"Max Shulman,Max Shulman";"Debbie Reynolds,Bobby Van,Barbara Ruick";"Debbie Reynolds,Bobby Van,Barbara Ruick,Bob Fosse,Hanley Stafford,Lurene Tuttle,Hans Conried,Charles Lane,Archer MacDonald,Kathleen Freeman,Almira Sessions";"English";"USA";"72 min";"6.1";"429";"15 user,2 critic";"Comedy,Musical";"Metro-Goldwyn-Mayer Studios - 10202 W. Washington Blvd., Culver City, California, USA";"Grainbelt University has one attraction for Dobie Gillis - women, especially Pansy Hammer. Pansy's father, even though and maybe because she says she's in dreamville, does not share her ..."
"tt0457433";"Perfect Stranger";"2007";"13 April 2007 (USA)";"James Foley";"Todd Komarnicki,Jon Bokenkamp";"Halle Berry,Bruce Willis,Giovanni Ribisi";"Halle Berry,Bruce Willis,Giovanni Ribisi,Richard Portnow,Gary Dourdan,Florencia Lozano,Nicki Aycox,Kathleen Chalfant,Gordon MacDonald,Daniella Van Graas,Paula Miranda,Patti D'Arbanville,Clea Lewis,Tamara Feldman,Gerry Becker";"English";"USA";"109 min";"5.7";"36,248";"168 user,159 critic";"Crime,Mystery,Thriller";"Manhattan, New York City, New York, USA";"A journalist goes undercover to ferret out businessman Harrison Hill as her childhood friend's killer. Posing as one of his temps, she enters into a game of online cat-and-mouse."
"tt1814905";"The Crying Dead";"2011";"31 October 2011 (USA)";"Hunter G. Williams";"Hunter G. Williams,Scott Michael Campbell";"Chris Hayes,Jeff Stearns,Becka Adams";"Chris Hayes,Jeff Stearns,Becka Adams,Angelina Lyubomirova,Callie Cameron,Kelsi Cullimore,Andrew Olson,Brooke Johnson,GiGi LaMar,Olivia Prado,Megan Richie,Liv von Oelreich,Sewell Whitney,Hunter G. Williams";"English";"USA";"81 min";"5.2";"723";"9 user,9 critic";"Adventure,Horror,Thriller";"California, USA";"In 2008 a cast and crew set out to shoot a pilot for a paranormal reality show. During the first night vague apparitions became violent hauntings. One by one they lost their lives. The ..."
"tt0443456";"Breaking and Entering";"2006";"10 November 2006 (UK)";"Anthony Minghella";"Anthony Minghella";"Jude Law,Robin Wright,Vera Farmiga";"Jude Law,Robin Wright,Martin Freeman,Juliette Binoche,Rafi Gavron,Ed Westwick,Serge Soric,Velibor Topic,Rad Lazar,Ting Ting Hu,Romi Aboulafia,Poppy Rogers,Eleanor Matsuura,Anna Chancellor,Lisa Kay";"English,Serbo-Croatian";"UK,USA";"120 min";"6.6";"19,461";"92 user,130 critic";"Drama,Romance";"Alexandra Park, Haringey, London, England, UK";"A landscape architect's dealings with a young thief cause him to re-evaluate his life."
"tt0070735";"The Sting";"1973";"26 December 1973 (UK)";"George Roy Hill";"David S. Ward";"Paul Newman,Robert Redford,Robert Shaw";"Paul Newman,Robert Redford,Robert Shaw,Charles Durning,Ray Walston,Eileen Brennan,Harold Gould,John Heffernan,Dana Elcar,Jack Kehoe,Dimitra Arliss,Robert Earl Jones,James Sloyan,Charles Dierkop,Lee Paul";"English";"USA";"129 min";"8.4";"159,077";"241 user,115 critic";"Comedy,Crime,Drama";"Hugus Alley, Pasadena, California, USA";"In Chicago in September 1936, a young con man seeking revenge for his murdered partner teams up with a master of the big con to win a fortune from a criminal banker."
"tt0462244";"Daddy Day Camp";"2007";"8 August 2007 (USA)";"Fred Savage";"Geoff Rodkey,J. David Stem";"Cuba Gooding Jr.,Lochlyn Munro,Richard Gant";"Cuba Gooding Jr.,Lochlyn Munro,Richard Gant,Tamala Jones,Paul Rae,Joshua David McLerran,Spencir Bridges,Brian Doyle-Murray,Dallin Boyce,Telise Galanis,Taggart Hurtubise,Molly Jepson,Tad D'Agostino,Tyger Rawlings,Talon G. Ackerman";"English";"USA";"93 min";"2.8";"11,716";"31 user,52 critic";"Comedy,Family";"Heber City, Utah, USA";"Seeking to offer his son the satisfying summer camp experience that eluded him as a child, the operator of a neighborhood daycare center opens his own camp, only to face financial hardship and stiff competition from a rival camp."
"tt0054188";"Please Don't Eat the Daisies";"1960";"2 June 1960 (West Germany)";"Charles Walters";"Isobel Lennart,Jean Kerr";"Doris Day,David Niven,Janis Paige";"Doris Day,David Niven,Janis Paige,Spring Byington,Richard Haydn,Patsy Kelly,Jack Weston,John Harding,Margaret Lindsay,Carmen Phillips,Mary Patton,Charles Herbert,Stanley Livingston,Flip Mark,Baby Gellert";"English";"USA";"112 min";"6.5";"2,836";"28 user,17 critic";"Comedy,Family,Romance";"Washington Square Park, Greenwich Village, Manhattan, New York City, New York, USA";"Drama critic Larry McKay, his wife Kay, and their four sons move from their crowded Manhattan apartment to an old house in the country. While housewife Kay settles into suburban life, Larry..."
"tt3727202";"Life on the Line";"2015";;"David Hackl";"Primo Brown,Peter I. Horton";"John Travolta,Kate Bosworth,Devon Sawa";"John Travolta,Kate Bosworth,Devon Sawa,Julie Benz,Sharon Stone,Gil Bellows,Ryan Robbins,Ty Olsson,Stuart Stone,Matt Bellefleur,Reese Alexander,Lydia Styslinger,Jorge Vargas,Emilie Ullerup,Ryleigh Gillespie";"English";"USA";;;;;"Action";"Vancouver, British Columbia, Canada";"A crew of men who do the high-wire work of fixing the electrical grid are hit by a sudden deadly storm."
"tt0067069";"Evel Knievel";"1971";"10 September 1971 (USA)";"Marvin J. Chomsky";"Alan Caillou,Alan Caillou";"George Hamilton,Sue Lyon,Bert Freed";"George Hamilton,Sue Lyon,Bert Freed,Rod Cameron,Dub Taylor,Ron Masak,Hal Baylor,Judith Baldwin,Kathrine Baumann,Ben Bentley,Alana Stewart,Joe Davis,Lee de Broux,Roger Edington,Frank Ellis";"English";"USA";"88 min";"5.2";"600";"13 user,10 critic";"Action,Biography,Drama";"Astrodome - 8400 Kirby Drive, Houston, Texas, USA";"Biography of the famed motorcycle daredevil, much of which was filmed in his home town of Butte, Montana. The film depicts Knievel reflecting on major events in his life just before a big ..."
"tt0066206";"Patton";"1970";"2 April 1970 (USA)";"Franklin J. Schaffner";"Francis Ford Coppola,Edmund H. North";"George C. Scott,Karl Malden,Stephen Young";"George C. Scott,Karl Malden,Stephen Young,Michael Strong,Carey Loftin,Albert Dumortier,Frank Latimore,Morgan Paull,Karl Michael Vogler,Bill Hickman,Pat Zurica,James Edwards,Lawrence Dobkin,David Bauer,John Barrie";"English,German,French,Russian,Arabic,Italian";"USA";"172 min";"8.0";"72,221";"245 user,107 critic";"Biography,Drama,War";"Almería, Andalucía, Spain";"The World War II phase of the career of the controversial American general, George S. Patton."
"tt0196216";"Small Time Crooks";"2000";"19 May 2000 (USA)";"Woody Allen";"Woody Allen";"Woody Allen,Tracey Ullman,Hugh Grant";"Woody Allen,Carolyn Saxon,Tracey Ullman,Michael Rapaport,Tony Darrow,Sam Josepher,Jon Lovitz,Lawrence Howard Levy,Diane Bradley,Crystal Field,Cindy Carver,Ray Garvey,Bill Gerber,Olivia Hayman,Laurine Towler";"English";"USA";"94 min";"6.7";"29,522";"189 user,125 critic";"Comedy,Crime";"Doyers Street, Manhattan, New York City, New York, USA";"A loser of a crook and his wife strike it rich when a botched bank job's cover business becomes a spectacular success."
"tt0029442";"The Prisoner of Zenda";"1937";"3 September 1937 (USA)";"John Cromwell,W.S. Van Dyke";"Anthony Hope,John L. Balderston";"Ronald Colman,Madeleine Carroll,C. Aubrey Smith";"Ronald Colman,Madeleine Carroll,C. Aubrey Smith,Raymond Massey,Mary Astor,David Niven,Douglas Fairbanks Jr.,Montagu Love,Philip Sleeman,Eleanor Wesselhoeft,Florence Roberts,Torben Meyer,Arthur Byron,Francis Ford,Margaret Tallichet";"English";"USA";"101 min";"7.8";"3,134";"41 user,7 critic";"Adventure,Drama,Romance";"California, USA";"An Englishman on a Ruritarian holiday must impersonate the king when the rightful monarch, a distant cousin, is drugged and kidnapped."
"tt0829459";"A Mighty Heart";"2007";"22 June 2007 (USA)";"Michael Winterbottom";"John Orloff,Mariane Pearl";"Angelina Jolie,Dan Futterman,Irrfan Khan";"Dan Futterman,Angelina Jolie,Archie Panjabi,Mohammed Afzal,Mushtaq Khan,Daud Khan,Telal Saeed,Arif Khan,Tipu Taheer,Amit Dhawan,Saira Nasir Khan,Aliya Khan,Sarah Mone,Bushra Parwani,Zafar Karachiwala";"English,French,Urdu,Arabic";"USA,UK";"108 min";"6.7";"23,493";"119 user,192 critic";"Biography,Drama,History";"Austin, Texas, USA";"Mariane Pearl embarks on a frantic search to locate her journalist husband, Daniel, when he goes missing in Pakistan."
"tt0100258";"Night of the Living Dead";"1990";"19 October 1990 (USA)";"Tom Savini";"John A. Russo,George A. Romero";"Tony Todd,Patricia Tallman,Tom Towles";"Tony Todd,Patricia Tallman,Tom Towles,McKee Anderson,William Butler,Katie Finneran,Bill Moseley,Heather Mazur,David W. Butler,Zachary Mott,Pat Reese,William Cameron,Pat Logan,Berle Ellis,Bill 'Chilly Billy' Cardille";"English";"USA";"92 min";"6.9";"28,950";"199 user,93 critic";"Horror,Thriller";"West Middletown Cemetery - 4699 Jefferson Ave, Avella, Pennsylvania, USA";"The unburied dead return to life and seek human victims."
"tt0101889";"The Fisher King";"1991";"27 September 1991 (USA)";"Terry Gilliam";"Richard LaGravenese";"Jeff Bridges,Robin Williams,Adam Bryant";"Jeff Bridges,Adam Bryant,Paul Lombardi,David Hyde Pierce,Ted Ross,Lara Harris,Warren Olney,Frazer Smith,Mercedes Ruehl,Kathy Najimy,Harry Shearer,Melinda Culea,James Remini,Mark Bowden,John Ottavino";"English";"USA";"137 min";"7.6";"59,384";"168 user,80 critic";"Comedy,Drama,Romance";"New York, USA";"A former radio DJ, suicidally despondent because of a terrible mistake he made, finds redemption in helping a deranged homeless man who was an unwitting victim of that mistake."
"tt0099512";"Ernest Goes to Jail";"1990";"6 April 1990 (USA)";"John R. Cherry III";"Charlie Cohen";"Jim Varney,Gailard Sartain,Bill Byrge";"Jim Varney,Gailard Sartain,Bill Byrge,Barbara Tyson,Barry Scott,Randall 'Tex' Cobb,Dan Leegant,Charles Napier,Jim Conrad,Jackie Welch,Melanie Wheeler,Jeffrey Buckner Ford,Daniel Butler,Charlie Lamb,Mac Bennett";"English";"USA";"81 min";"5.3";"7,010";"36 user,10 critic";"Comedy,Crime,Family";"Tennessee, USA";"Bumbling Ernest P. Worrell is assigned to jury duty, where a crooked lawyer notices a resemblance with crime boss Mr. Nash, and arranges a switch. Nash assumes Ernest's job as a bank ..."
"tt0038427";"Courage of Lassie";"1946";"8 November 1946 (USA)";"Fred M. Wilcox";"Lionel Houser";"Elizabeth Taylor,Frank Morgan,Tom Drake";"Elizabeth Taylor,Frank Morgan,Tom Drake,Selena Royle,Harry Davenport,George Cleveland,Catherine McLeod,Morris Ankrum,Mitchell Lewis,Jane Green,David Holt,Bill Wallace,Minor Watson,Donald Curtis,Clancy Cooper";"English";"USA";"92 min";"6.3";"876";"18 user,6 critic";"Drama,Adventure,Family";"Railroad Creek, Washington, USA";"Bill's separated from his litter, making friends with the wild creatures until he's found and adopted by young Kathie. An accident separates him from her, and he's drafted into K-9 duty in ..."
"tt1669814";"Rise of the Fellowship";"2013";"3 December 2013 (USA)";"Ron Newcomb";"Christopher Bunn,Scott Mathias";"Justin Moe,Jayme Bell,Cole Matson";"Justin Moe,Jayme Bell,Cole Matson,Emma Earnest,Wolf J. Sherrill,Jason Krznarich,Aaron Bowman-Fields,Eric Garner,Doug Henderson,Drew Trementozzi,Melissa Temme,Noah Baron,Ashley Batten,Mike Bunting,Anthony Capizzano";"English";"USA";"92 min";"4.4";"520";"9 user,12 critic";"Adventure,Comedy,Fantasy";;"Randall Dooley is a geek. His three best friends are geeks too. He works in a game shop, he spends all his free time playing online games, his older brother bullies him unmercifully, his ..."
"tt0198386";"The Crew";"2000";"25 August 2000 (USA)";"Michael Dinner";"Barry Fanaro";"Richard Dreyfuss,Burt Reynolds,Dan Hedaya";"Richard Dreyfuss,Burt Reynolds,Dan Hedaya,Seymour Cassel,Carrie-Anne Moss,Jennifer Tilly,Lainie Kazan,Miguel Sandoval,Jeremy Piven,Casey Siemaszko,Matthew Borlenghi,Billy Jayne,Jeremy Ratchford,Mike Moroff,José Zúñiga";"English,Spanish";"USA";"88 min";"5.6";"3,795";"46 user,53 critic";"Crime,Comedy";"Miami, Florida, USA";"Four retired mobsters plan one last crime to save their retirement home."
"tt0030265";"If I Were King";"1938";"11 November 1938 (USA)";"Frank Lloyd";"Justin Huntly McCarthy,Preston Sturges";"Ronald Colman,Basil Rathbone,Frances Dee";"Ronald Colman,Basil Rathbone,Frances Dee,Ellen Drew,C.V. France,Henry Wilcoxon,Heather Thatcher,Stanley Ridges,Bruce Lester,Alma Lloyd,Walter Kingsford,Sidney Toler,Colin Tapley,Ralph Forbes,John Miljan";"English";"USA";"101 min";"7.4";"446";"12 user,4 critic";"Adventure,History";"Paramount Studios - 5555 Melrose Avenue, Hollywood, Los Angeles, California, USA";"Vagabond poet François Villon rises to high office in 1463 Paris."
"tt0138524";"Intolerable Cruelty";"2003";"10 October 2003 (USA)";"Joel Coen,Ethan Coen";"Robert Ramsey,Matthew Stone";"George Clooney,Catherine Zeta-Jones,Billy Bob Thornton";"George Clooney,Catherine Zeta-Jones,Geoffrey Rush,Cedric the Entertainer,Edward Herrmann,Paul Adelstein,Richard Jenkins,Billy Bob Thornton,Julia Duffy,Jonathan Hadary,Tom Aldredge,Stacey Travis,Jack Kyle,Irwin Keyes,Judith Drake";"English,French";"USA";"100 min";"6.3";"71,997";"319 user,158 critic";"Comedy,Crime,Romance";"L'Orangerie - 903 North La Cienega Boulevard, Los Angeles, California, USA";"A revenge-seeking gold digger marries a womanizing Beverly Hills lawyer with the intention of making a killing in the divorce."
"tt0120630";"Chicken Run";"2000";"23 June 2000 (USA)";"Peter Lord,Nick Park";"Peter Lord,Nick Park";"Mel Gibson,Julia Sawalha,Phil Daniels";"Phil Daniels,Lynn Ferguson,Mel Gibson,Tony Haygarth,Jane Horrocks,Miranda Richardson,Julia Sawalha,Timothy Spall,Imelda Staunton,Benjamin Whitrow,John Sharian,Jo Allen,Lisa Kay,Laura Strachan";"English";"UK,USA,France";"84 min";"7.0";"130,102";"356 user,186 critic";"Animation,Family,Comedy";;"When a bird 'flies' into a chicken farm, the fellow chickens see him as an opportunity to escape their evil owners."
