"tt0083959";"Forbidden World";"1982";"7 May 1982 (USA)";"Allan Holzman";"Tim Curnen,Jim Wynorski";"Jesse Vint,Dawn Dunlap,June Chadwick";"Jesse Vint,Dawn Dunlap,June Chadwick,Linden Chiles,Fox Harris,Ray Oliver,Scott Paulin,Michael Bowen,Don Olivera";"English";"USA";"77 min";"5.3";"1,917";"32 user,69 critic";"Horror,Sci-Fi";"Santa Clarita, California, USA";"In the distant future, a federation marshal arrives at a research lab on a remote planet where a genetic experiment has gotten lose and begins feeding on the dwindling scientific group."
"tt2784512";"Zombeavers";"2014";"20 March 2015 (USA)";"Jordan Rubin";"Al Kaplan,Jordan Rubin";"Rachel Melvin,Cortney Palm,Lexi Atkins";"Rachel Melvin,Cortney Palm,Lexi Atkins,Hutch Dano,Jake Weary,Peter Gilroy,Rex Linn,Brent Briscoe,Phyllis Katz,Robert R. Shafer,Bill Burr,John Mayer,Jordan Rubin,Sonny Tanning,Fred Tatasciore";"English";"USA";"77 min";"4.8";"9,054";"64 user,131 critic";"Comedy,Horror";"Santa Clarita, California, USA";"A fun weekend turns into madness and horror for a bunch of groupies looking for fun in a beaver infested swamp."
"tt1355683";"Black Mass";"2015";"18 September 2015 (USA)";"Scott Cooper";"Mark Mallouk,Jez Butterworth";"Johnny Depp,Benedict Cumberbatch,Dakota Johnson";"Johnny Depp,Joel Edgerton,Benedict Cumberbatch,Dakota Johnson,Kevin Bacon,Peter Sarsgaard,Jesse Plemons,Rory Cochrane,David Harbour,Adam Scott,Corey Stoll,Julianne Nicholson,W. Earl Brown,Bill Camp,Juno Temple";"English";"USA";"122 min";"7.6";"17,410";"119 user,177 critic";"Biography,Crime,Drama";"Harvard Club of Boston, 374 Commonwealth Ave, Boston, Massachusetts, USA";"The true story of Whitey Bulger, the brother of a state senator and the most infamous violent criminal in the history of South Boston, who became an FBI informant to take down a Mafia family invading his turf."
"tt0043880";"On Moonlight Bay";"1951";"6 June 1952 (Finland)";"Roy Del Ruth";"Jack Rose,Melville Shavelson";"Doris Day,Gordon MacRae,Jack Smith";"Doris Day,Gordon MacRae,Jack Smith,Leon Ames,Rosemary DeCamp,Mary Wickes,Ellen Corby,Billy Gray,Henry East,Jeffrey Stevens,Eddie Marr";"English";"USA";"95 min";"7.1";"1,646";"25 user,8 critic";"Comedy,Musical,Romance";;"The Winfield family moves into a new house in a small town in Indiana. Tomboy Marjorie Winfield begins a romance with William Sherman who lives across the street. Marjorie has to learn how ..."
"tt0053925";"House of Usher";"1960";"22 June 1960 (USA)";"Roger Corman";"Edgar Allan Poe,Richard Matheson";"Vincent Price,Mark Damon,Myrna Fahey";"Vincent Price,Mark Damon,Myrna Fahey,Harry Ellerbe";"English";"USA";"79 min";"7.0";"7,807";"82 user,93 critic";"Horror";"California, USA";"A man, upon entering his fiancées's family mansion, discovers a savage family curse and fears that his future brother-in-law has entombed his bride-to-be prematurely."
"tt0053604";"The Apartment";"1960";"16 September 1960 (France)";"Billy Wilder";"Billy Wilder,I.A.L. Diamond";"Jack Lemmon,Shirley MacLaine,Fred MacMurray";"Jack Lemmon,Shirley MacLaine,Fred MacMurray,Ray Walston,Jack Kruschen,David Lewis,Hope Holiday,Joan Shawlee,Naomi Stevens,Johnny Seven,Joyce Jameson,Willard Waterman,David White,Edie Adams";"English";"USA";"125 min";"8.3";"98,264";"235 user,174 critic";"Comedy,Drama,Romance";"205 Columbus Avenue, New York City, New York, USA";"A man tries to rise in his company by letting its executives use his apartment for trysts, but complications and a romance of his own ensue."
"tt0079817";"Rocky II";"1979";"15 June 1979 (USA)";"Sylvester Stallone";"Sylvester Stallone";"Sylvester Stallone,Talia Shire,Burt Young";"Sylvester Stallone,Talia Shire,Burt Young,Carl Weathers,Burgess Meredith,Tony Burton,Joe Spinell,Leonard Gaines,Sylvia Meals,Frank McRae,Al Silvani,John Pleshette,Stu Nahan,Bill Baldwin,Jerry Ziesmer";"English,Italian";"USA";"119 min";"7.1";"118,602";"153 user,56 critic";"Drama,Sport";"Pennsylvania, USA";"Rocky struggles in family life after his bout with Apollo Creed, while the embarrassed champ insistently goads him to accept a challenge for a rematch."
"tt0061989";"Monkeys, Go Home!";"1967";"8 February 1967 (USA)";"Andrew V. McLaglen";"Maurice Tombragel,G.K. Wilkinson";"Maurice Chevalier,Dean Jones,Yvette Mimieux";"Maurice Chevalier,Dean Jones,Yvette Mimieux,Bernard Woringer,Clément Harari,Yvonne Constant,Marcel Hillaire,Jules Munshin,Alan Carney,Maurice Marsac,Darleen Carr";"English";"USA";"101 min";"5.8";"310";"5 user,4 critic";"Comedy,Family";"Walt Disney Studios, 500 South Buena Vista Street, Burbank, California, USA";"Henry Dussard, a young American, inherits a picturesque but badly neglected olive farm in southern France and is determined to make it operational again despite cautionary advice from the ..."
"tt0268978";"A Beautiful Mind";"2001";"4 January 2002 (USA)";"Ron Howard";"Akiva Goldsman,Sylvia Nasar";"Russell Crowe,Ed Harris,Jennifer Connelly";"Russell Crowe,Ed Harris,Jennifer Connelly,Christopher Plummer,Paul Bettany,Adam Goldberg,Josh Lucas,Anthony Rapp,Jason Gray-Stanford,Judd Hirsch,Austin Pendleton,Vivien Cardone,Jillie Simon,Victor Steinbach,Tanya Clarke";"English";"USA";"135 min";"8.2";"541,013";"1,159 user,201 critic";"Biography,Drama";"Bayonne, New Jersey, USA";"After a brilliant but asocial mathematician, John Nash, accepts secret work in cryptography, his life takes a turn for the nightmarish."
"tt2758904";"Search Party";"2014";"2015 (USA)";"Scot Armstrong";"Mike Gagerman,Andrew Waller";"Krysten Ritter,Rosa Salazar,Alison Brie";"Krysten Ritter,Rosa Salazar,Alison Brie,Riki Lindhome,T.J. Miller,Maurice Compte,Kate Micucci,Shannon Woodward,Lance Reddick,Jason Mantzoukas,Adam Pally,Thomas Middleditch,Brian Huskey,J.B. Smoove,Jon Glaser";"English,Spanish";"USA";"93 min";"5.5";"2,081";"12 user,6 critic";"Comedy";"Baton Rouge, Louisiana, USA";"A pair of friends embark on a mission to reunite their pal with the woman he was going to marry."
"tt0111001";"The Road to Wellville";"1994";"28 October 1994 (USA)";"Alan Parker";"T. Coraghessan Boyle,Alan Parker";"Anthony Hopkins,Bridget Fonda,Matthew Broderick";"Anthony Hopkins,Bridget Fonda,Matthew Broderick,John Cusack,Dana Carvey,Michael Lerner,Colm Meaney,John Neville,Lara Flynn Boyle,Traci Lind,Camryn Manheim,Roy Brocksmith,Norbert Weisser,Monica Parker,Jacob Reynolds";"English";"USA";"118 min";"5.7";"9,476";"98 user,14 critic";"Comedy,Drama";"North Carolina, USA";"A story about the ins and outs of one unusual health facility in the early 20th century, run by the eccentric Dr. Kellogg."
"tt0039998";"The Wistful Widow of Wagon Gap";"1947";"8 October 1947 (USA)";"Charles Barton";"D.D. Beauchamp,William Bowers";"Bud Abbott,Lou Costello,Marjorie Main";"Bud Abbott,Lou Costello,Marjorie Main,Audrey Young,George Cleveland,Gordon Jones,William Ching,Peter M. Thompson,Bill Clauson,Bill O'Leary,Pamela Wells,Jimmy Bates,Paul Dunn,Diane Florentine,Rex Lease";"English";"USA";"78 min";"7.3";"835";"10 user,2 critic";"Action,Comedy,Family";"Vasquez Rocks, Vasquez Rocks Natural Area Park - 10700 W. Escondido Canyon Rd., Agua Dulce, California, USA";"Chester Wooley (Lou Costello) and Duke Egan (Bud Abbott) are traveling salesmen who make a stopover in Wagon Gap, Montana while en route to California. During the stopover, a notorious ..."
"tt0241527";"Harry Potter and the Sorcerer's Stone";"2001";"16 November 2001 (USA)";"Chris Columbus";"J.K. Rowling,Steve Kloves";"Daniel Radcliffe,Rupert Grint,Richard Harris";"Richard Harris,Maggie Smith,Robbie Coltrane,Saunders Triplets,Daniel Radcliffe,Fiona Shaw,Harry Melling,Richard Griffiths,Derek Deadman,Ian Hart,Ben Borowiecki,Warwick Davis,Verne Troyer,John Hurt,Richard Bremmer";"English";"UK,USA";"152 min";"7.5";"402,103";"1,548 user,257 critic";"Adventure,Family,Fantasy";"London, England, UK";"Rescued from the outrageous neglect of his aunt and uncle, a young boy with a great destiny proves his worth while attending Hogwarts School of Witchcraft and Wizardry."
"tt3475020";"Catching Faith";"2015";"2015 (South Africa)";"John K.D. Graham";"Alexandra Boylan,John K.D. Graham";"Lorena Segura York,Garrett Westton,Bill Engvall";"Lorena Segura York,Garrett Westton,Bill Engvall,Bethany Peterson,Dariush Moslemi,Kathie Butler,Brian P. Joyce,Alexandra Boylan,Lizz Carter,Maxwell Hawksford,Carl K. Smiskey,Isabelle Polnaszek,Jael Polnaszek,Rebecca Kaye,Nathan Stockwell";"English";"USA";"88 min";"6.4";"83";"5 user,21 critic";"Drama,Family,Sport";"Chippewa Falls, Wisconsin, USA";"A Christian mother's inferiority complex becomes exacerbated when her husband discovers their high school football star son has been drinking, challenging her faith and self-worth."
"tt0799949";"Epic Movie";"2007";"26 January 2007 (USA)";"Jason Friedberg,Aaron Seltzer";"Jason Friedberg,Aaron Seltzer";"Kal Penn,Jennifer Coolidge,Fred Willard";"Kal Penn,Adam Campbell,Jennifer Coolidge,Jayma Mays,Faune Chambers Watkins,Crispin Glover,Tony Cox,Héctor Jiménez,Darrell Hammond,Carmen Electra,Fred Willard,David Carradine,Kevin McDonald,George Alvarez,Crista Flanagan";"English";"USA";"86 min";"2.3";"85,862";"664 user,111 critic";"Adventure,Comedy";"Los Angeles, California, USA";"A comedic satire of films that are large in scope, reputation and popularity"
"tt1716747";"Hellraiser: Revelations";"2011";"18 October 2011 (USA)";"Víctor García";"Gary J. Tunnicliffe";"Nick Eversman,Fred Tatasciore,Steven Brand";"Nick Eversman,Fred Tatasciore,Steven Brand,Tracey Fairaway,Daniel Buran,Jolene Andersen,Sebastien Roberts,Jay Gillespie,Sanny van Heteren,Stephan Smith Collins,Devon Sorvari,Adel Marie Ruiz,Sue Ann Pien,Camelia Dee";"English,Spanish";"USA";"75 min";"2.8";"4,171";"70 user,62 critic";"Horror";"Los Angeles, California, USA";"In this ninth installment of the Hellraiser franchise, two friends discover a puzzle box in Mexico, which opens a gateway to Hell. Before long, dermatological nightmare Pinhead has returned..."
"tt1817273";"The Place Beyond the Pines";"2012";"19 April 2013 (USA)";"Derek Cianfrance";"Derek Cianfrance,Ben Coccio";"Ryan Gosling,Bradley Cooper,Eva Mendes";"Ryan Gosling,Craig Van Hook,Eva Mendes,Olga Merediz,Angelo Anthony Pizza,Mahershala Ali,John Facci,Ben Mendelsohn,Tula,Penny,Cynthia Pelletier-Sullivan,Mackenzie Trainor,Nicole Califano,Shannon Plumb,Tracey Agustin";"English,Spanish";"USA";"140 min";"7.3";"172,604";"363 user,415 critic";"Crime,Drama,Thriller";"Glenville, New York, USA";"A motorcycle stunt rider turns to robbing banks as a way to provide for his lover and their newborn child, a decision that puts him on a collision course with an ambitious rookie cop navigating a department ruled by a corrupt detective."
"tt3014866";"Criminal";"2016";"15 April 2016 (USA)";"Ariel Vromen";"Douglas Cook,David Weisberg";"Ryan Reynolds,Alice Eve,Gal Gadot";"Ryan Reynolds,Alice Eve,Gal Gadot,Kevin Costner,Gary Oldman,Michael Pitt,Tommy Lee Jones,Antje Traue,Scott Adkins,Amaury Nolasco,Jordi Mollà,Robert Davi,Natalie Burn,Anastasia Harrold,Doug Cockle";"English";"UK,USA";;;;;"Action,Crime,Drama";"Croydon, London, England, UK";"The memories & skills of a deceased CIA agent are implanted into an unpredictable and dangerous convict."
"tt0199753";"Red Planet";"2000";"10 November 2000 (USA)";"Antony Hoffman";"Chuck Pfarrer,Chuck Pfarrer";"Val Kilmer,Carrie-Anne Moss,Tom Sizemore";"Val Kilmer,Carrie-Anne Moss,Tom Sizemore,Benjamin Bratt,Simon Baker,Terence Stamp,Jessica Morton,Caroline Bossi,Bob Neill";"English";"USA,Australia";"106 min";"5.6";"45,462";"346 user,144 critic";"Action,Sci-Fi,Thriller";"Boral Quarry, Prospect, Sydney, New South Wales, Australia";"Astronauts, and their robotic dog AMME, search for solutions to save a dying Earth by searching on Mars, only to have the mission go terribly awry."
"tt0070723";"Soylent Green";"1973";"9 May 1973 (USA)";"Richard Fleischer";"Stanley R. Greenberg,Harry Harrison";"Charlton Heston,Edward G. Robinson,Leigh Taylor-Young";"Charlton Heston,Leigh Taylor-Young,Chuck Connors,Joseph Cotten,Brock Peters,Paula Kelly,Edward G. Robinson,Stephen Young,Mike Henry,Lincoln Kilpatrick,Roy Jenson,Leonard Stone,Whit Bissell,Celia Lovsky,Dick Van Patten";"English,Spanish";"USA";"97 min";"7.1";"41,387";"232 user,136 critic";"Mystery,Sci-Fi,Thriller";"Los Angeles Sports Arena - 3939 S. Figueroa Street, Exposition Park, Los Angeles, California, USA";"With the world ravaged by the greenhouse effect and overpopulation, an NYPD detective investigates the murder of a CEO with ties to the world's main food supply."
"tt0084060";"Heidi's Song";"1982";"19 November 1982 (USA)";"Robert Taylor";"Joseph Barbera,Jameson Brewer";"Lorne Greene,Sammy Davis Jr.,Margery Gray";"Lorne Greene,Sammy Davis Jr.,Margery Gray,Michael Bell,Peter Cullen,Roger DeWitt,Richard Erdman,Fritz Feld,Pamelyn Ferdin,Joan Gerber,Virginia Gregg,Janet Waldo,Frank Welker,Michael Winslow,Sue Allen";"English";"USA";"94 min";"6.1";"190";"8 user,6 critic";"Animation,Family,Musical";;"Add a Plot"
"tt2014338";"Side by Side";"2012";"22 August 2012 (USA)";"Christopher Kenneally";"Christopher Kenneally";"Derek Ambrosi,Michael Ballhaus,Andrzej Bartkowiak";"Derek Ambrosi,Michael Ballhaus,Andrzej Bartkowiak,Dion Beebe,Jill Bogdanowicz,Danny Boyle,Geoff Boyle,James Cameron,Michael Chapman,Don Ciana,Anne V. Coates,Lorenzo di Bonaventura,Anthony Dod Mantle,Lena Dunham,Jonathan Fawkner";"English";"USA";"99 min";"7.7";"10,481";"41 user,97 critic";"Documentary";;"The documentary investigates the history, process and workflow of both digital and photochemical film creation."
"tt1598778";"Contagion";"2011";"9 September 2011 (USA)";"Steven Soderbergh";"Scott Z. Burns";"Matt Damon,Kate Winslet,Jude Law";"Gwyneth Paltrow,Tien You Chui,Josie Ho,Daria Strokous,Matt Damon,Griffin Kane,Yoshiaki Kobayashi,Laurence Fishburne,John Hawkes,Jude Law,Monique Gabriela Curnen,Teri McEvoy,Sue Redman,Teri Campbell,Stef Tovar";"English,Mandarin,Cantonese";"USA,United Arab Emirates";"106 min";"6.7";"171,212";"400 user,429 critic";"Drama,Sci-Fi,Thriller";"Taylor Street, San Francisco, California, USA";"Healthcare professionals, government officials and everyday people find themselves in the midst of a worldwide epidemic as the CDC works to find a cure."
"tt0043274";"Alice in Wonderland";"1951";"26 July 1951 (USA)";"Clyde Geronimi,Wilfred Jackson";"Lewis Carroll,Winston Hibler";"Kathryn Beaumont,Ed Wynn,Richard Haydn";"Kathryn Beaumont,Ed Wynn,Richard Haydn,Sterling Holloway,Jerry Colonna,Verna Felton,J. Pat O'Malley,Bill Thompson,Heather Angel,Joseph Kearns,Larry Grey,Queenie Leonard,Dink Trout,Doris Lloyd,James MacDonald";"English";"USA";"75 min";"7.4";"87,859";"140 user,90 critic";"Animation,Adventure,Family";"Walt Disney Studios, 500 South Buena Vista Street, Burbank, California, USA";"Alice stumbles into the world of Wonderland. Will she get home? Not if the Queen of Hearts has her way."
"tt0217869";"Unbreakable";"2000";"22 November 2000 (USA)";"M. Night Shyamalan";"M. Night Shyamalan";"Bruce Willis,Samuel L. Jackson,Robin Wright";"Bruce Willis,Samuel L. Jackson,Robin Wright,Spencer Treat Clark,Charlayne Woodard,Eamonn Walker,Leslie Stefanson,Johnny Hiram Jamison,Michaelia Carroll,Bostin Christopher,Elizabeth Lawrence,Davis Duffield,Laura Regan,Chance Kelly,Michael Kelly";"English";"USA";"106 min";"7.2";"232,491";"1,324 user,291 critic";"Drama,Mystery,Sci-Fi";"Franklin Field - 235 S. 33rd Street, University of Pennsylvania, Philadelphia, Pennsylvania, USA";"A man learns something extraordinary about himself after a devastating accident."
"tt1763316";"The Theatre Bizarre";"2011";"9 May 2012 (France)";"Douglas Buck,Buddy Giovinazzo";"Zach Chassler,Richard Stanley";"Udo Kier,Virginia Newcomb,Amanda Marquardt";"Udo Kier,Virginia Newcomb,Amanda Marquardt,Amelia M. Gotham,Jeremy Gladen,Liberty Larson,Christopher Sachs,Nicole Fabbri,Catriona MacColl,Shane Woodward,Victoria Maurette,Lisa Belle,Amelie Salomon,André Hennicke,Suzan Anbeh";"English,French";"USA,France,Canada";"114 min";"5.1";"2,947";"35 user,83 critic";"Horror";"Berlin, Germany";"Down a seedy city street in her neighborhood, young Enola Penny is obsessed with what appears to be a long abandoned theatre. One night, she sees that the front door is slightly ajar and ..."
"tt0310793";"Bowling for Columbine";"2002";"15 November 2002 (USA)";"Michael Moore";"Michael Moore";"Michael Moore,Charlton Heston,Marilyn Manson";"Michael Moore,Salvador Allende,Jacobo Arbenz,Mike Bradley,Arthur A. Busch,George Bush,George W. Bush,Michael Caldwell,Richard Castaldo,Dick Clark,Bill Clinton,Steve Davis,Ngo Dinh Diem,Mike Epstein,Joe Farmer";"English";"Canada,USA,Germany";"120 min";"8.0";"117,647";"882 user,213 critic";"Documentary";"Auburn Hills, Michigan, USA";"Filmmaker Michael Moore explores the roots of America's predilection for gun violence."
"tt3565026";"Vincent the Artist";"2017";"2017 (USA)";"Vincent J. Wiley,Deborah Romare";"Deborah Romare,Vincent J. Wiley";"Martin Klebba";"Martin Klebba";"English";"USA,India";;;;;"Animation";"Hollywood, Los Angeles, California, USA";"Add a Plot"
"tt0055100";"Lover Come Back";"1961";"3 March 1962 (USA)";"Delbert Mann";"Stanley Shapiro,Paul Henning";"Rock Hudson,Doris Day,Tony Randall";"Rock Hudson,Doris Day,Tony Randall,Edie Adams,Jack Oakie,Jack Kruschen,Ann B. Davis,Howard St. John,Joe Flynn,Jack Albertson,Charles Watts,Ward Ramsey,Karen Norris,Donna Douglas";"English";"USA";"107 min";"7.3";"4,681";"43 user,21 critic";"Comedy,Romance";"Universal Studios - 100 Universal City Plaza, Universal City, California, USA";"A series of misunderstandings leaves an advertising executive with a campaign for a product which has not been invented yet while he romances his rival in the guise of its inventor."
"tt0245479";"Just a Kiss";"2002";"15 May 2003 (Australia)";"Fisher Stevens";"Patrick Breen,Patrick Breen";"Ron Eldard,Kyra Sedgwick,Marisa Tomei";"Marley Shelton,Ron Eldard,Patrick Breen,Sanjiv Jhaveri,Kelly Cole,Kyra Sedgwick,Zoe Caldwell,Marisa Tomei,Peter Dinklage,Hollis Granville,Sarita Choudhury,Zofia Borucka,Billy Strong,Bruno Amato,Donna Hanover";"English";"USA";"89 min";"5.1";"1,248";"27 user,27 critic";"Comedy,Romance";"New York City, New York, USA";"A group of thirtysomethings having problems with fidelity gets an opportunity to turn back the clock."
"tt0790636";"Dallas Buyers Club";"2013";"22 November 2013 (USA)";"Jean-Marc Vallée";"Craig Borten,Melisa Wallack";"Matthew McConaughey,Jennifer Garner,Jared Leto";"Matthew McConaughey,Jennifer Garner,Jared Leto,Denis O'Hare,Steve Zahn,Michael O'Neill,Dallas Roberts,Griffin Dunne,Kevin Rankin,Donna Duplantier,Deneen Tyler,J.D. Evermore,Ian Casselberry,Noelle Wilcox,Bradford Cox";"English,Japanese";"USA";"117 min";"8.0";"286,888";"328 user,463 critic";"Biography,Drama";"New Orleans, Louisiana, USA";"In 1985 Dallas, electrician and hustler Ron Woodroof works around the system to help AIDS patients get the medication they need after he is diagnosed with the disease."
"tt0462465";"Outlander";"2008";"11 July 2008 (Latvia)";"Howard McCain";"Dirk Blackman,Howard McCain";"Jim Caviezel,Sophia Myles,Ron Perlman";"Jim Caviezel,Sophia Myles,Jack Huston,John Hurt,Cliff Saunders,Patrick Stevenson,Aidan Devine,Ron Perlman,Bailey Maughan,John Nelles,James Preston Rogers,Scott Owen,Petra Prazak,Owen Pattison,Matt Cooke";"English,Norse, Old,Latin";"USA,Germany,France";"115 min";"6.3";"61,579";"155 user,113 critic";"Action,Adventure,Sci-Fi";"Bay of Islands, Newfoundland, Newfoundland and Labrador, Canada";"During the reign of the Vikings, Kainan, a man from a far-off world, crash lands on Earth, bringing with him an alien predator known as the Moorwen. Though both man and monster are seeking revenge for violence committed against them, Kainan leads the alliance to kill the Moorwen by fusing his advanced technology with the Viking's Iron Age weaponry."
"tt0052296";"A Time to Love and a Time to Die";"1958";"15 September 1958 (Sweden)";"Douglas Sirk";"Orin Jannings,Erich Maria Remarque";"John Gavin,Liselotte Pulver,Jock Mahoney";"John Gavin,Liselotte Pulver,Jock Mahoney,Don DeFore,Keenan Wynn,Erich Maria Remarque,Dieter Borsche,Barbara Rütting,Thayer David,Charles Regnier,Dorothea Wieck,Kurt Meisel,Agnes Windeck,Clancy Cooper,John Van Dreelen";"English,German,Russian";"USA,West Germany";"132 min";"7.8";"1,854";"12 user,21 critic";"Drama,Romance,War";"Hopfenohe, Grafenwöhr, Bavaria, Germany";"On the Russian front in 1944 German Private Ernst Graeber receives a leave and visits his family in Germany but Germany isn't the same country he left behind."
"tt0117011";"Maximum Risk";"1996";"13 September 1996 (USA)";"Ringo Lam";"Larry Ferguson";"Jean-Claude Van Damme,Natasha Henstridge,Jean-Hugues Anglade";"Jean-Claude Van Damme,Natasha Henstridge,Jean-Hugues Anglade,Zach Grenier,Paul Ben-Victor,Frank Senger,Stefanos Miltsakakis,Frank Van Keeken,David Hemblen,Stéphane Audran,Dan Moran,Donald Burda,Rob Kaman,Herb Lovelle,Denis Costanzo";"English";"USA";"101 min";"5.4";"14,990";"64 user,47 critic";"Action,Crime,Mystery";"Dundas Square, Toronto, Ontario, Canada";"A policeman takes his twin brother's place and inherits his problems and a beautiful girlfriend. He is forced to kickbox his way from France to the U.S. and back while playing footsie with ..."
"tt0320661";"Kingdom of Heaven";"2005";"6 May 2005 (USA)";"Ridley Scott";"William Monahan";"Orlando Bloom,Eva Green,Liam Neeson";"Martin Hancock,Michael Sheen,Nathalie Cox,Eriq Ebouaney,Jouko Ahola,David Thewlis,Liam Neeson,Philip Glenister,Orlando Bloom,Bronson Webb,Kevin McKidd,Nikolaj Coster-Waldau,Steven Robertson,Marton Csokas,Alexander Siddig";"English,Arabic,Latin,Italian";"USA,UK,Spain,Germany,Morocco";"144 min";"7.2";"201,850";"934 user,237 critic";"Action,Adventure,Drama";"Morocco";"Balian of Ibelin travels to Jerusalem during the crusades of the 12th century, and there he finds himself as the defender of the city and its people."
"tt2689958";"Big Sky";"2015";"14 August 2015 (USA)";"Jorge Michel Grau";"Evan M. Wiener";"Bella Thorne,Kyra Sedgwick,Frank Grillo";"Bella Thorne,Kyra Sedgwick,Frank Grillo,Aaron Tveit,François Arnaud,Ricky Tollman,Jodi Lynn Thomas,Beth Bailey,Michael Sheets,Clif Stokes,Mark Sivertsen,Chiara Aurelia,Terry Dale Parks";"English";"USA";"90 min";"4.3";"467";"4 user,12 critic";"Drama,Thriller";"New Mexico, USA";"A teen traveling with her mother to a treatment center for her agoraphobia has to fight for their lives against a gunman who attacks them."
"tt0087843";"Once Upon a Time in America";"1984";"28 September 1984 (Italy)";"Sergio Leone";"Harry Grey,Leonardo Benvenuti";"Robert De Niro,James Woods,Elizabeth McGovern";"Robert De Niro,James Woods,Elizabeth McGovern,Joe Pesci,Burt Young,Tuesday Weld,Treat Williams,Danny Aiello,Richard Bright,James Hayden,William Forsythe,Darlanne Fluegel,Larry Rapp,Richard Foronjy,Robert Harper";"English,Italian,French";"Italy,USA";"229 min";"8.4";"199,341";"485 user,109 critic";"Crime,Drama";"Intersection of Washington Street and Water Street, Dumbo, Brooklyn, New York City, New York, USA";"A former Prohibition-era Jewish gangster returns to the Lower East Side of Manhattan over thirty years later, where he once again must confront the ghosts and regrets of his old life."
"tt0049843";"There's Always Tomorrow";"1956";"February 1956 (USA)";"Douglas Sirk";"Bernard C. Schoenfeld,Ursula Parrott";"Barbara Stanwyck,Fred MacMurray,Joan Bennett";"Barbara Stanwyck,Fred MacMurray,Joan Bennett,William Reynolds,Pat Crowley,Gigi Perreau,Jane Darwell,Race Gentry,Myrna Hansen,Judy Nugent,Paul Smith,Helen Kleeb,Jane Howard,Frances Mercer,Sheila Bromley";"English";"USA";"84 min";"7.7";"1,581";"19 user,29 critic";"Drama,Romance";"Apple Valley Inn - Apple Valley Inn Road, Apple Valley, California, USA";"When a toy manufacturer feels ignored and unappreciated by by his wife and children, he begins to rekindle a past love when a former employee comes back into his life."
"tt0213260";"Split Infinity";"1992";;"Stan Ferguson";"Forrest S. Baker III,Sharon Baker";"Melora Slover,Marcia Dangerfield,Devin Healey";"Melora Slover,Marcia Dangerfield,Devin Healey,David Jensen,Heath Ezell,Isaac Shamy,H.E.D. Redford,Jodi Webb,Mary Bishop,Jonathan Wilde,Vaioliti Purcell,Talia Argyle,Vicki Gunn,Jennifer McDonald,Thom Dillon";"English";"USA";"90 min";"6.3";"191";"3 user,2 critic";"Drama,Family,Fantasy";"Layton, Utah, USA";"Although 14-year-old 'fashion plate' and entrepreneur A.J. Knowlton loves her down-to-earth, middle-class family, her behavior toward them often reflects irritation and embarrassment. She ..."
"tt0052918";"Imitation of Life";"1959";"30 April 1959 (USA)";"Douglas Sirk";"Eleanore Griffin,Allan Scott";"Lana Turner,John Gavin,Sandra Dee";"Lana Turner,John Gavin,Sandra Dee,Susan Kohner,Robert Alda,Dan O'Herlihy,Juanita Moore,Karin Dicker,Terry Burnham,John Vivyan,Lee Goodman,Ann Robinson,Troy Donahue,Sandra Gould,David Tomack";"English";"USA";"125 min";"7.9";"10,282";"140 user,46 critic";"Drama,Romance";"Aquarius Theater - 6230 Sunset Blvd., Hollywood, Los Angeles, California, USA";"A struggling young actress with a six-year-old daughter sets up housekeeping with a homeless black widow and her light-skinned eight-year-old daughter who rejects her mother by trying to pass for white."
"tt0089885";"Re-Animator";"1985";"18 October 1985 (USA)";"Stuart Gordon";"H.P. Lovecraft,Dennis Paoli";"Jeffrey Combs,Bruce Abbott,Barbara Crampton";"Jeffrey Combs,Bruce Abbott,Barbara Crampton,David Gale,Robert Sampson,Gerry Black,Carolyn Purdy-Gordon,Peter Kent,Barbara Pieters,Ian Patrick Williams,Bunny Summers,Al Berry,Derek Pendleton,Gene Scherer,James Ellis";"English,German";"USA";"104 min";"7.3";"36,239";"199 user,189 critic";"Comedy,Horror,Sci-Fi";"Los Angeles, California, USA";"A dedicated student at a medical college and his girlfriend become involved in bizarre experiments centering around the re-animation of dead tissue when an odd new student arrives on campus."
