"Id";"Name";"Year";"Release Date";"Director";"Creator";"Actors";"Cast";"Language";"Country";"Duration";"RatingValue";"RatingCount";"ReviewCount";"Genre";"Filming Locations";"Description"
"tt0826823";"Magic";"2010";"2010 (USA)";"Robert Davi";"John Penney,Leo Grillo";"Leo Grillo,Sammi Hanratty,Lori Heuring";"Leo Grillo,Sammi Hanratty,Lori Heuring,Robert Davi,Jed the Dog,Elaine Hendrix,Tanya Allen,Greg Grunberg,Lee de Broux,Tonyo Meléndez,Raynor Scheine,Di Koob,Bob Bancroft,Brandon Epland,Bob Joles";"English";"USA";;"3.0";"96";;"Adventure,Family";"Acton, California, USA";"'Magic' the dog is an angel sent to heal a broken family. Brad is a lawyer, doing the best he can to raise his daughter Kayla without the wife he misses. Kayla is longing for her mother, ..."
"tt1742334";"Sabotage";"2014";"28 March 2014 (USA)";"David Ayer";"Skip Woods,David Ayer";"Arnold Schwarzenegger,Sam Worthington,Terrence Howard";"Arnold Schwarzenegger,Sam Worthington,Joe Manganiello,Josh Holloway,Terrence Howard,Max Martini,Kevin Vance,Mark Schlegel,Ned Yousef,Mireille Enos,Maurice Compte,Martin Donovan,Michael Monks,Nick Chacon,Tim Ware";"English";"USA";"109 min";"5.7";"42,946";"204 user,230 critic";"Action,Crime,Drama";"Atlanta, Georgia, USA";"Members of an elite DEA task force find themselves being taken down one by one after they rob a drug cartel safe house."
"tt0069089";"Pink Flamingos";"1972";"October 1979 (West Germany)";"John Waters";"John Waters";"Divine,David Lochary,Mary Vivian Pearce";"Divine,David Lochary,Mary Vivian Pearce,Mink Stole,Danny Mills,Edith Massey,Channing Wilroy,Cookie Mueller,Paul Swift,Susan Walsh,Linda Olgeirson,Pat Moran,Jack Walsh,Bob Skidmore,Pat Lefaiver";"English";"USA";"93 min";"6.1";"15,725";"182 user,69 critic";"Comedy,Crime,Horror";"Baltimore, Maryland, USA";"Notorious Baltimore criminal and underground figure Divine goes up against Connie & Raymond Marble, a sleazy married couple who make a passionate attempt to humiliate her and seize her tabloid-given title as 'The Filthiest Person Alive'."
"tt0026866";"Peter Ibbetson";"1935";"7 November 1935 (USA)";"Henry Hathaway";"Vincent Lawrence,Waldemar Young";"Gary Cooper,Ann Harding,John Halliday";"Gary Cooper,Ann Harding,John Halliday,Ida Lupino,Douglass Dumbrille,Virginia Weidler,Dickie Moore,Doris Lloyd,Gilbert Emery,Donald Meek,Christian Rub,Elsa Buchanan,Bodil Rosing";"English,French";"USA";"88 min";"7.1";"1,128";"29 user,14 critic";"Drama,Fantasy,Romance";"Big Bear Lake, Big Bear Valley, San Bernardino National Forest, California, USA";"Architect Peter Ibbetson is hired by the Duke of Towers to design a building for him. Ibbetson discovers that the Duchess of Towers, Mary, is his now-grown childhood sweetheart. Their love ..."
"tt0089360";"Jagged Edge";"1985";"4 October 1985 (USA)";"Richard Marquand";"Joe Eszterhas";"Jeff Bridges,Glenn Close,Peter Coyote";"Maria Mayenzet,Peter Coyote,Dave Austin,Richard Partlow,Lance Henriksen,William Allen Young,Ben Hammer,Jeff Bridges,James Karen,Sanford Jensen,Woody Eney,Al Ruscio,Sharon Hanian,Sarah Cunningham,Glenn Close";"English";"USA";"108 min";"6.4";"9,626";"80 user,24 critic";"Crime,Thriller,Mystery";"1761 Potrero Road, Hidden Valley, Thousand Oaks, California, USA";"San Francisco heiress Page Forrester is brutally murdered in her remote beach house. Her husband Jack is devastated by the crime but soon finds himself accused of her murder. He hires ..."
"tt0046246";"Rob Roy: The Highland Rogue";"1953";"27 February 1954 (USA)";"Harold French";"Lawrence Edward Watkin";"Richard Todd,Glynis Johns,James Robertson Justice";"Richard Todd,Glynis Johns,James Robertson Justice,Michael Gough,Finlay Currie,Jean Taylor Smith,Geoffrey Keen,Archie Duncan,Russell Waters,Marjorie Fielding,Eric Pohlmann,Ina De La Haye,Michael Goodliffe,Martin Boddey,Ewen Solon";"English,Scottish Gaelic";"UK,USA";"81 min";"6.6";"299";"5 user";"Adventure,Biography,Drama";"Scotland, UK";"The wartime adventures of Scotish highland leader Rob Roy MacGregor during the reign of King George I in the 18th century."
"tt2102475";"Wolf";"2012";"11 March 2012 (USA)";"Ya'Ke Smith";"Ya'Ke Smith";"Selena Aguilar,Pedro Castaneda,Jordan Cooper";"Selena Aguilar,Pedro Castaneda,Jordan Cooper,Mikala Gibson,Irma P. Hall,Amelia Jeffries,Shelton Jolivette,Eugene Lee,Tim Newkirk,Xavier Ramirez,Monique Straw,Gabi Walker,Nikki Young";"English";"USA";;"8.1";"87";"14 user,5 critic";"Drama,Family";"San Antonio, Texas, USA";"A family is shaken to the core when they discover that their son has been molested. As they struggle to deal with the betrayal, their son heads towards a total mental collapse because of his love for his abuser."
"tt4758646";"War Machine";"2016";"2016 (USA)";"David Michôd";"Michael Hastings";"Brad Pitt,Will Poulter,Anthony Michael Hall";"Brad Pitt,Will Poulter,Anthony Michael Hall,Topher Grace,RJ Cyler,Scoot McNairy,John Magaro,Anthony Hayes,Alexander Furno,Justin Rosniak,Andrew Byron,Elham Ehsas,Teresa Shaughnessy";"English";"USA";;;;;"Comedy";;"A satire of America's war with Afghanistan with a focus on the people running the campaign."
"tt2910342";"Dakota's Summer";"2014";"1 April 2014 (USA)";"Timothy Armstrong";"Timothy Armstrong,Timothy Armstrong";"Haley Ramm,Bryan Dechart,Glynn Turman";"Haley Ramm,Bryan Dechart,Glynn Turman,Emily Bett Rickards,Walt Roberts,Kimberly Whalen,Amber Dawn Landrum,Haley Ganzel,Leslie-Anne Huff,Derrick Strickland,Mark Nutter,Keith Carradine,Jade Pettyjohn,Liz Mikel,Jennie Kamin";"English";"USA";"91 min";"5.5";"505";"1 user,6 critic";"Drama,Family";"Ruston, Louisiana, USA";"Keith Carradine stars alongside a young, popular cast in this inspiring second chapter of the beloved Cowgirls 'N Angels story filled with heart, horses & high-reaching adventure."
"tt0286788";"What a Girl Wants";"2003";"4 April 2003 (USA)";"Dennie Gordon";"William Douglas-Home,William Douglas-Home";"Amanda Bynes,Colin Firth,Kelly Preston";"Amanda Bynes,Colin Firth,Kelly Preston,Eileen Atkins,Anna Chancellor,Jonathan Pryce,Oliver James,Christina Cole,Sylvia Syms,Soleil McGhee,Peter Reeves,James Greene,Steven Osborne,Mike Toller,Tom Penn";"English";"USA";"105 min";"5.8";"44,564";"193 user,65 critic";"Comedy,Drama,Romance";"Battersea Park, Battersea, London, England, UK";"An American teenager learns that her father is a wealthy British politician running for office. Although she is eager to find him, she realizes it could cause a scandal and cost him the election."
"tt0104850";"Memoirs of an Invisible Man";"1992";"28 February 1992 (USA)";"John Carpenter";"H.F. Saint,Robert Collector";"Chevy Chase,Daryl Hannah,Sam Neill";"Chevy Chase,Daryl Hannah,Sam Neill,Michael McKean,Stephen Tobolowsky,Jim Norton,Pat Skipper,Paul Perri,Richard Epcar,Steven Barr,Gregory Paul Martin,Patricia Heaton,Barry Kivel,Donald Li,Rosalind Chao";"English";"USA,France";"99 min";"5.9";"16,293";"63 user,37 critic";"Comedy,Romance,Sci-Fi";"Greystone Park & Mansion - 905 Loma Vista Drive, Beverly Hills, California, USA";"After a freak accident, an invisible yuppie runs for his life from a treacherous CIA official while trying to cope with his new life."
"tt0119784";"The Night Flier";"1997";"6 February 1998 (USA)";"Mark Pavia";"Stephen King,Mark Pavia";"Miguel Ferrer,Julie Entwisle,Dan Monahan";"Miguel Ferrer,Julie Entwisle,Dan Monahan,Michael H. Moss,John Bennes,Beverly Skinner,Rob Wilds,Richard K. Olsen,Elizabeth McCormick,J.R. Rodriguez,Robert Leon Casey,Ashton Stewart,William Neely,Windy Wenderlich,General Fermon Judd Jr.";"English";"USA,Italy";"94 min";"5.9";"6,657";"77 user,38 critic";"Fantasy,Horror,Mystery";"Wilmington, North Carolina, USA";"A reporter is on the trail of a vampiric murderer who travels by plane."
"tt0088708";"American Ninja";"1985";"30 August 1985 (USA)";"Sam Firstenberg";"Paul De Mielche,Avi Kleinberger";"Michael Dudikoff,Steve James,Judie Aronson";"Michael Dudikoff,Steve James,Judie Aronson,Guich Koock,John Fujioka,Don Stewart,John LaMotta,Tadashi Yamashita,Phillip Brock,Tony Carreon,Roi Vinzon,Manolet Escudero,Greg Rocero,Berto Spoor,Michael Hackbart";"English";"USA";"95 min";"5.3";"9,641";"71 user,41 critic";"Action,Adventure,Romance";"Philippines";"American soldier, obviously very skilled in martial arts, single-handedly takes on mercenaries in the Philippines."
"tt0094721";"Beetlejuice";"1988";"30 March 1988 (USA)";"Tim Burton";"Michael McDowell,Larry Wilson";"Alec Baldwin,Geena Davis,Michael Keaton";"Alec Baldwin,Geena Davis,Annie McEnroe,Maurice Page,Hugo Stanger,Michael Keaton,Rachel Mittelman,Catherine O'Hara,J. Jay Saunders,Mark Ettlinger,Jeffrey Jones,Winona Ryder,Glenn Shadix,Patrice Martinez,Cindy Daly";"English";"USA";"92 min";"7.5";"171,530";"294 user,103 critic";"Comedy,Fantasy";"Culver Studios - 9336 W. Washington Blvd., Culver City, California, USA";"A couple of recently deceased ghosts contract the services of a 'bio-exorcist' in order to remove the obnoxious new owners of their house."
"tt1810710";"My Trip Back to the Dark Side";"2014";"May 2014 (South Korea)";"Shane Stanley";"Joshua Baerwald,William T. Smith";"Jason Pace,Sean Kanan,Betsy Russell";"Jason Pace,Sean Kanan,Betsy Russell,Courtney Gains,Ryan Judd,Sean Young,Kathy Christopherson,Brienne De Beau,Marlon Young,Ron Masak,Sidney S. Liufau,Alisa Reyes,Krizia Bajos,Hillary Clark,Jamie Janek";"English";"USA";"94 min";"4.9";"851";"3 user,1 critic";"Thriller";"Westlake Village, California, USA";"A dramatic turn of events forces Shawn Stone to take another trip to the dark side. This time he and David Prince join forces to make The Foreign Exchange."
"tt0113845";"Money Train";"1995";"22 November 1995 (USA)";"Joseph Ruben";"Doug Richardson,Doug Richardson";"Wesley Snipes,Woody Harrelson,Jennifer Lopez";"Wesley Snipes,Woody Harrelson,Jennifer Lopez,Robert Blake,Chris Cooper,Joe Grifasi,Scott Sowers,Skipp Sudduth,Vincent Laresca,Nelson Vasquez,Vincent Patrick,Aida Turturro,Alvaleta Guess,Vincent Pastore,David Tawil";"English";"USA";"110 min";"5.5";"30,557";"59 user,38 critic";"Action,Comedy,Crime";"John Street, Greenwich Village, Manhattan, New York City, New York, USA";"A vengeful New York transit cop decides to steal a trainload of subway fares$% his foster brother, a fellow cop, tries to protect him."
"tt0088011";"Romancing the Stone";"1984";"30 March 1984 (USA)";"Robert Zemeckis";"Diane Thomas";"Michael Douglas,Kathleen Turner,Danny DeVito";"Michael Douglas,Kathleen Turner,Danny DeVito,Zack Norman,Alfonso Arau,Manuel Ojeda,Holland Taylor,Mary Ellen Trainor,Eve Smith,Joe Nesnow,José Chávez,Evita Muñoz 'Chachita',Camillo García,Rodrigo Puebla,Paco Morayta";"English,Spanish,French";"USA,Mexico";"106 min";"6.9";"59,755";"114 user,57 critic";"Action,Adventure,Comedy";"Huasca de Ocampo, Hidalgo, Mexico";"A romance writer sets off to Colombia to ransom her kidnapped sister, and soon finds herself in the middle of a dangerous adventure."
"tt2312602";"Reincarnated";"2012";"22 March 2013 (UK)";"Andy Capper";;"Snoop Dogg,Dr. Dre,Damian Marley";"Theocracy Reign Ivine Order of the Nyahbinghi,Dr. Dre,Daz Dillinger,Angela Hunte,Ariel Rechtshaid,Dre Skull,Jahdan Blakkamoore,Andrew aka Moon Bain,Bunny Wailer,Damian Marley,Dave Dale and The Blue Mountain Coffee House Boys,Sister Shirley Chung and Winston Martin,The Alpha Boys,Scaby Dread and the Dudus Family,Cutty Corn";"English";"USA";"96 min";"6.2";"1,497";"6 user,15 critic";"Documentary,Music";"Jamaica";"Hip-Hop artist Snoop Dogg changes his name to Snoop Lion, travels to Jamaica, immerses himself in Rastafarian culture, and produces his first reggae record."
"tt1817273";"The Place Beyond the Pines";"2012";"19 April 2013 (USA)";"Derek Cianfrance";"Derek Cianfrance,Ben Coccio";"Ryan Gosling,Bradley Cooper,Eva Mendes";"Ryan Gosling,Craig Van Hook,Eva Mendes,Olga Merediz,Angelo Anthony Pizza,Mahershala Ali,John Facci,Ben Mendelsohn,Tula,Penny,Cynthia Pelletier-Sullivan,Mackenzie Trainor,Nicole Califano,Shannon Plumb,Tracey Agustin";"English,Spanish";"USA";"140 min";"7.3";"172,604";"363 user,415 critic";"Crime,Drama,Thriller";"Glenville, New York, USA";"A motorcycle stunt rider turns to robbing banks as a way to provide for his lover and their newborn child, a decision that puts him on a collision course with an ambitious rookie cop navigating a department ruled by a corrupt detective."
"tt0024684";"Topaze";"1933";"24 February 1933 (USA)";"Harry d'Abbadie d'Arrast";"Ben Hecht,Charles Lederer";"John Barrymore,Myrna Loy,Reginald Mason";"John Barrymore,Myrna Loy,Reginald Mason,Jobyna Howland,Jackie Searl,Albert Conti,Frank Reicher,Luis Alberni,Lowden Adams";"English";"USA";"78 min";"6.8";"509";"20 user,3 critic";"Drama,Comedy";;"An honest and naive schoolteacher gets a lesson in how the world works outside the classroom, when a rich Baron and his mistress use the teacher's name and outstanding reputation in a ..."
"tt0316356";"Open Range";"2003";"15 August 2003 (USA)";"Kevin Costner";"Lauran Paine,Craig Storper";"Kevin Costner,Robert Duvall,Diego Luna";"Robert Duvall,Kevin Costner,Annette Bening,Michael Gambon,Michael Jeter,Diego Luna,James Russo,Abraham Benrubi,Dean McDermott,Kim Coates,Herb Kohler,Peter MacNeill,Cliff Saunders,Patricia Stutz,Julian Richings";"English";"USA";"139 min";"7.5";"51,284";"489 user,151 critic";"Action,Romance,Western";"Alberta, Canada";"A former gunslinger is forced to take up arms again when he and his cattle crew are threatened by a corrupt lawman."
"tt0365737";"Syriana";"2005";"9 December 2005 (USA)";"Stephen Gaghan";"Stephen Gaghan,Robert Baer";"George Clooney,Matt Damon,Amanda Peet";"Kayvan Novak,George Clooney,Amr Waked,Christopher Plummer,Jeffrey Wright,Chris Cooper,Robert Foxworth,Nicky Henson,Nicholas Art,Matt Damon,Amanda Peet,Steven Hinkle,Daisy Tormé,Peter Gerety,Richard Lintern";"English,Urdu,Arabic,Persian,French,Mandarin";"USA,United Arab Emirates";"128 min";"7.0";"103,371";"624 user,357 critic";"Drama,Thriller";"Annapolis, Maryland, USA";"A politically-charged epic about the state of the oil industry in the hands of those personally involved and affected by it."
"tt1385826";"The Adjustment Bureau";"2011";"4 March 2011 (USA)";"George Nolfi";"George Nolfi,Philip K. Dick";"Matt Damon,Emily Blunt,Lisa Thoreson";"Matt Damon,Emily Blunt,Lisa Thoreson,Florence Kastriner,Michael Kelly,Phyllis MacBryde,Natalie Carter,Chuck Scarborough,Jon Stewart,Gregory P. Hitchen,Darrell Lenormand,Michael Bloomberg,Kar,RJ Konner,Susan D. Michaels";"English";"USA";"106 min";"7.1";"188,085";"397 user,408 critic";"Romance,Sci-Fi,Thriller";"Statue of Liberty, Liberty Island, New York Harbor, New York City, New York, USA";"The affair between a politician and a ballerina is affected by mysterious forces keeping the lovers apart."
"tt0120347";"Tomorrow Never Dies";"1997";"19 December 1997 (USA)";"Roger Spottiswoode";"Bruce Feirstein";"Pierce Brosnan,Jonathan Pryce,Michelle Yeoh";"Pierce Brosnan,Jonathan Pryce,Michelle Yeoh,Teri Hatcher,Ricky Jay,Götz Otto,Joe Don Baker,Vincent Schiavelli,Judi Dench,Desmond Llewelyn,Samantha Bond,Colin Salmon,Geoffrey Palmer,Julian Fellowes,Terence Rigby";"English,German,Danish,Mandarin,Cantonese";"UK,USA";"119 min";"6.5";"138,355";"314 user,149 critic";"Action,Adventure,Thriller";"Jaws, Peahi Beach, Maui, Hawaii, USA";"James Bond heads to stop a media mogul's plan to induce war between China and the UK in order to obtain exclusive global media coverage."
"tt0337656";"Keep Your Distance";"2005";"12 August 2005 (USA)";"Stu Pollard";"Stu Pollard";"Gil Bellows,Jennifer Westfeldt,Christian Kane";"Gil Bellows,Jennifer Westfeldt,Christian Kane,Kim Raver,Jamie Harrold,Elizabeth Peña,Stacy Keach,Gary Anthony Williams,Cynthia Martells,Dennis Burkley,Brooke L. Berry,Rick Overton,Jenny McShane,Lisa Baldwin,Andy Blieden";"English";"USA";"94 min";"5.4";"1,069";"59 user,4 critic";"Drama,Mystery,Romance";"Louisville, Kentucky, USA";"In the perfectly normal town of Louisville, KY, there is a perfectly normal man living the perfect life. David Dailey is a man who has it all: A great career, a community that adores him, ..."
"tt0109836";"Mary Shelley's Frankenstein";"1994";"4 November 1994 (USA)";"Kenneth Branagh";"Mary Shelley,Steph Lady";"Robert De Niro,Kenneth Branagh,Helena Bonham Carter";"Robert De Niro,Kenneth Branagh,Tom Hulce,Helena Bonham Carter,Aidan Quinn,Ian Holm,Richard Briers,John Cleese,Robert Hardy,Cherie Lunghi,Celia Imrie,Trevyn McDowell,Gerard Horan,Mark Hadfield,Joanna Roth";"English";"USA,Japan";"123 min";"6.4";"40,487";"244 user,85 critic";"Drama,Horror,Romance";"England, UK";"When the brilliant but unorthodox scientist Victor Frankenstein rejects the artificial man that he has created, the Creature escapes and later swears revenge."
"tt0095894";"Pound Puppies and the Legend of Big Paw";"1988";"18 March 1988 (USA)";"Pierre DeCelles";"Terrence McDonnell,Jim Carlson";"Greg Berg,Ruth Buzzi,Nancy Cartwright";"Greg Berg,Ruth Buzzi,Nancy Cartwright,Cathy Cavadini,Ryan Davis,Joey Dedio,Ashley Hall,Brennan Howard,Janice Kawaye,Alwyn Kushner,Jasper Kushner,Robbie Lee,Tony Longo,Hal Rayle,George Rose";"English";"USA";"76 min";"4.8";"444";"13 user,1 critic";"Animation,Comedy,Family";;"On a magical artifact called the Bone of Scone, that gives 'Puppy Power' to the Pound Puppies and Pound Purries. However, a villain named Marvin McNasty plans to take it and use it for ..."
"tt0038559";"Gilda";"1946";"15 March 1946 (USA)";"Charles Vidor";"E.A. Ellington,Jo Eisinger";"Rita Hayworth,Glenn Ford,George Macready";"Rita Hayworth,Glenn Ford,George Macready,Joseph Calleia,Steven Geray,Joe Sawyer,Gerald Mohr,Mark Roberts,Ludwig Donath,Donald Douglas";"English,Spanish,French,German";"USA";"110 min";"7.8";"18,641";"144 user,77 critic";"Drama,Film-Noir,Romance";;"Johnny Farrell is a gambling cheat who turns straight to work for an unsettling casino owner Ballin Mundson. But things take a turn for Johnny as his alluring ex-lover appears as Mundson's wife, and Mundson's machinations begin to unravel."
"tt0086927";"Bachelor Party";"1984";"29 June 1984 (USA)";"Neal Israel";"Bob Israel,Neal Israel";"Tom Hanks,Tawny Kitaen,Adrian Zmed";"Tom Hanks,Tawny Kitaen,Adrian Zmed,George Grizzard,Barbara Stuart,Robert Prescott,William Tepper,Wendie Jo Sperber,Barry Diamond,Gary Grossman,Michael Dudikoff,Bradford Bancroft,Martina Finch,Deborah Harmon,Tracy Smith";"English,Japanese";"USA";"105 min";"6.2";"27,057";"78 user,34 critic";"Comedy";"John Marshall High School - 3939 Tracy Street, Los Feliz, Los Angeles, California, USA";"A soon-to-be-married man's friends throw him the ultimate bachelor party."
"tt0118708";"Beverly Hills Ninja";"1997";"17 January 1997 (USA)";"Dennis Dugan";"Mark Feldberg,Mitchell Klebanoff";"Chris Farley,Nicollette Sheridan,Robin Shou";"Chris Farley,Nicollette Sheridan,Robin Shou,Nathaniel Parker,Soon-Tek Oh,Keith Cooke,Chris Rock,François Chau,Dale Ishimoto,Daming Chen,Burt Bulos,Curtis Blanck,Tom Bailey,Jason Tobin,Richard Kline";"English";"USA";"88 min";"5.5";"28,791";"64 user,26 critic";"Action,Comedy";"950 Mei Ling Way, Los Angeles, California, USA";"A man tries to rescue a woman with a little help from his half brother."
"tt1709684";"M.O.N.";"2006";"15 May 2006 (USA)";"Brian Lupo";"Brian Lupo";"Leada Ghareaghadje,Lindsay Coffelt,Donovan Vincent Kit";"Leada Ghareaghadje,Lindsay Coffelt,Donovan Vincent Kit,Amanda Rivera,Joe Hammernik,Karen Rueb,Joe Hamernik,Angelina Rivera";"English";"USA";"67 min";"7.6";"28";;"Horror,Thriller";"Goats Head, California, USA";"Based on the true account of the M.O.N. murders$% four friends experience first hand the psychotic mind of a madman as told through one of the most bizarre letters written by an anonymous ..."
"tt1375670";"Grown Ups";"2010";"25 June 2010 (USA)";"Dennis Dugan";"Adam Sandler,Fred Wolf";"Adam Sandler,Salma Hayek,Kevin James";"Adam Sandler,Kevin James,Chris Rock,David Spade,Rob Schneider,Salma Hayek,Maria Bello,Maya Rudolph,Joyce Van Patten,Ebony Jo-Ann,Di Quon,Steve Buscemi,Colin Quinn,Tim Meadows,Madison Riley";"English,Spanish";"USA";"102 min";"6.0";"167,278";"310 user,178 critic";"Comedy";"Woodmans of Essex, 121 Main Street, Essex, Massachusetts, USA";"After their high school basketball coach passes away, five good friends and former teammates reunite for a Fourth of July holiday weekend."
"tt0896866";"Standard Operating Procedure";"2008";"29 May 2008 (Germany)";"Errol Morris";;"Megan Ambuhl Graner,Javal Davis,Ken Davis";"Megan Ambuhl Graner,Javal Davis,Ken Davis,Anthony Diaz,Tim Dugan,Lynndie England,Jeffrey Frost,Sabrina Harman,Janis Karpinski,Roman Krol,Brent Pack,Jeremy Sivits,Christopher Bradley,Sarah Denning,Robin Dill";"English";"USA";"116 min";"7.5";"3,186";"22 user,119 critic";"Documentary,Crime,War";;"Errol Morris examines the incidents of abuse and torture of suspected terrorists at the hands of U.S. forces at the Abu Ghraib prison."
"tt0062793";"Charlie, the Lonesome Cougar";"1967";"18 October 1967 (USA)";"Winston Hibler";"Jack Speirs,Jack Speirs";"Ron Brown,Brian Russell,Linda Wallace";"Ron Brown,Brian Russell,Linda Wallace,Jim Wilson,Lewis Sample,Clifford Peterson,Edward C. Moller,Charlie,Rex Allen";"English";"USA";"75 min";"6.7";"542";"9 user,4 critic";"Adventure,Family";"Broughton Log Flume, Columbia River Gorge, Washington, USA";"When a cougar raised by a group of loggers in the Pacific Northwest reverts to its natural instincts, the consequence could threaten its life."
"tt0052296";"A Time to Love and a Time to Die";"1958";"15 September 1958 (Sweden)";"Douglas Sirk";"Orin Jannings,Erich Maria Remarque";"John Gavin,Liselotte Pulver,Jock Mahoney";"John Gavin,Liselotte Pulver,Jock Mahoney,Don DeFore,Keenan Wynn,Erich Maria Remarque,Dieter Borsche,Barbara Rütting,Thayer David,Charles Regnier,Dorothea Wieck,Kurt Meisel,Agnes Windeck,Clancy Cooper,John Van Dreelen";"English,German,Russian";"USA,West Germany";"132 min";"7.8";"1,854";"12 user,21 critic";"Drama,Romance,War";"Hopfenohe, Grafenwöhr, Bavaria, Germany";"On the Russian front in 1944 German Private Ernst Graeber receives a leave and visits his family in Germany but Germany isn't the same country he left behind."
"tt0332379";"School of Rock";"2003";"3 October 2003 (USA)";"Richard Linklater";"Mike White";"Jack Black,Mike White,Joan Cusack";"Jack Black,Adam Pascal,Lucas Papaelias,Chris Stack,Sarah Silverman,Mike White,Lucas Babin,Joan Cusack,Jordan-Claire Green,Veronica Afflerbach,Miranda Cosgrove,Joey Gaydos Jr.,Robert Tsai,Angelo Massagli,Kevin Alexander Clark";"English";"USA,Germany";"108 min";"7.1";"193,617";"472 user,201 critic";"Comedy,Music";"Buckley Country Day School - I.U. Willets Road, Herricks, Long Island, New York, USA";"After being kicked out of a rock band, Dewey Finn becomes a substitute teacher of a strict elementary private school, only to try and turn it into a rock band."
"tt0035417";"The Talk of the Town";"1942";"20 August 1942 (USA)";"George Stevens";"Irwin Shaw,Sidney Buchman";"Cary Grant,Jean Arthur,Ronald Colman";"Cary Grant,Jean Arthur,Ronald Colman,Edgar Buchanan,Glenda Farrell,Charles Dingle,Emma Dunn,Rex Ingram,Leonid Kinskey,Tom Tyler,Don Beddoe";"English";"USA";"118 min";"7.6";"5,062";"62 user,32 critic";"Comedy,Drama,Romance";;"An escaped prisoner and a stuffy law professor vie for the hand of a spirited schoolteacher."
"tt0319470";"The Guys";"2002";"20 November 2003 (Germany)";"Jim Simpson";"Anne Nelson,Anne Nelson";"Sigourney Weaver,Anthony LaPaglia,Irene Walsh";"Sigourney Weaver,Anthony LaPaglia,Irene Walsh,Jim Simpson,Charlotte Simpson,Julian Trompeter,Katharine Schreiber,Lucas DeBassac,Joshua Ross,Alfredo Narciso,Julia Nelson Black,David Nelson Black,Anthony Bonaventura,Marcus Collins,Tim Cummings";"English";"USA";"84 min";"6.5";"1,116";"28 user,32 critic";"Drama";"New York City, New York, USA";"The story of a fire captain who lost eight men in the collapse of the World Trade Center and the editor who helps him prepare the eulogies he must deliver."
"tt0199753";"Red Planet";"2000";"10 November 2000 (USA)";"Antony Hoffman";"Chuck Pfarrer,Chuck Pfarrer";"Val Kilmer,Carrie-Anne Moss,Tom Sizemore";"Val Kilmer,Carrie-Anne Moss,Tom Sizemore,Benjamin Bratt,Simon Baker,Terence Stamp,Jessica Morton,Caroline Bossi,Bob Neill";"English";"USA,Australia";"106 min";"5.6";"45,462";"346 user,144 critic";"Action,Sci-Fi,Thriller";"Boral Quarry, Prospect, Sydney, New South Wales, Australia";"Astronauts, and their robotic dog AMME, search for solutions to save a dying Earth by searching on Mars, only to have the mission go terribly awry."
"tt0095326";"Hot to Trot";"1988";"26 August 1988 (USA)";"Michael Dinner";"Stephen Neigher,Hugo Gilbert";"Bobcat Goldthwait,Dabney Coleman,John Candy";"Bobcat Goldthwait,Dabney Coleman,John Candy,Virginia Madsen,Cindy Pickett,Jim Metzler,Tim Kazurinsky,Santos Morales,Barbara Whinnery,Garry Kluger,Mary Gross,Liz Torres,Jocko Marcellino,Deanna Oliver,Harry Caesar";"English";"USA";"83 min";"4.3";"2,468";"18 user,8 critic";"Comedy,Fantasy";"Santa Clarita, California, USA";"Fred P. Chaney receives as inheritance after the death of his mother a speaking horse that also has good knowledge about the stock-market. With the help of this horse Fred gains a lot at ..."
"tt0115604";"Babe Watch: Forbidden Parody";"1996";"14 August 2007 (Hungary)";"Rick Sloane";"Rick Sloane";"Raelyn Saalman,Tane McClure,Ashlie Rhey";"Raelyn Saalman,Tane McClure,Ashlie Rhey,Steven Todd Lange,Geoffrey Hughes,Christopher Tichy,Kelli Hoffman,Steven Johnson,Jordana Gowan,Karen Knotts,Honey Lauren,Michael Morgan,Amy Burdick,Philippe Bergeron,Mandy Harvey";"English";"USA";;"2.8";"123";"4 user,2 critic";;;"Add a Plot"
